778243823	Just happened a terrible car crash
778243824	Our Deeds are the Reason of this #earthquake May ALLAH Forgive us all
778243835	#flood #disaster Heavy rain causes flash flooding of streets in Manitou, Colorado Springs areas
778254819	Meet Brinco your own personal earthquake snd tsunami early warning beacon. http://t.co/NXkUM9h7wD
778254825	Help support the victims of the Japanese Earthquake and Pacific Tsunami http://t.co/O5GbPBQH http://t.co/MN5wnxf0 #hope4japan #pray4japan
778254826	It's alil twister at Tha end to! I was like oh nah ??
778254827	Gail and Russell saw lots of hail at their Dalroy home - they have video of twister 1/2 mile from their home #yyc http://t.co/3VfKEdGrsO
778254830	If a landslide tumbles down todayI'm on your side And if a twister sweeps it all away- YOU'RE ON YOUR OWN BITCH!*runs into distance*
778254837	Twister hits 4 villages in Quezon province - http://t.co/ehJv0gvo47 http://t.co/pzJcRNrBSr #Quezon #news
778254851	when you get stuck on the wicked twister and they have to call maintenance to get you out.. http://t.co/7iFPMFssMU
778254852	Crazy Mom Threw Teen Daughter a NUDE Twister Sex Party According To Her Friend50 =&gt;http://t.co/Hy5Pbe12TM http://t.co/c1nJpLi5oR
778254858	Tornadoes: El Nino may give Canada's twister season a boost #Toronto http://t.co/agyCutKBnN
778254876	#Breaking144 Obama Declares Disaster for Typhoon-Devastated Saipan: Obama signs disaster declarat... http://t.co/M8CIKs60BX #AceNewsDesk
778254877	Map: Typhoon Soudelor's predicted path as it approaches Taiwan; expected to make landfall over southern China by S_ http://t.co/JDVSGVhlIs
778254878	Find out how your fund was used for Typhoon Haiyan in the Philippines. See @DevPeace Haiyan Relief Funds Report http://t.co/JwxrX1LsqO
778254879	Global precipitation measurement satellite captures 3-D image of Typhoon Soudelor - NASAHurricane. Visit: http://t.co/sQN4girdvZ
778254880	Struggling to Return to Life: Makurazaki Typhoon on September 17 1945 killed thousands. http://t.co/fmp0JsH4wX http://t.co/X3TotYZAZe
778254881	Obama Declares Disaster for Typhoon-Devastated Saipan: Obama signs disaster declaration for Northern Marians a... http://t.co/Hni4v2ZUk3
778254882	Obama Declares Disaster for Typhoon-Devastated Saipan: Obama signs disaster declaration for Northern Marians a... http://t.co/UsVyHdG9OG
778254883	#Map: Typhoon Soudelor's predicted path as it approaches Taiwan; expected to make landfall over southern China by _ http://t.co/PgD7UXtVGg
778254884	#breaking #news Global precipitation measurement satellite captures 3-D image of Typhoon Soudelor - @NASAHurricane http://t.co/20DNcthr4D
778254885	Obama Declares Disaster for Typhoon-Devastated Saipan: Obama signs disaster declaration for Northern Marians a... http://t.co/Q3DtOqO04c
778254886	Obama signs disaster declaration for Northern Marians after typhoon hits US territory  http://t.co/0IPaVKJgDC
778254887	Obama Declares Disaster for Typhoon-Devastated Saipan: Obama signs disaster declaration for Northern Marians a... http://t.co/qjuU0wcWPx
778254888	@FoxNews let me report it to u people instead Mr.Obama just declares CNMI federal disaster area post typhoon soudelor. U guys 2slow2report.
778254889	abcnews - Obama Declares Disaster for Typhoon-Devastated Saipan: Obama signs disaster declaration for Northern... http://t.co/mg5eAJElul
778254890	Typhoon Soudelor: When will it hit Taiwan  and how bad will it be? #GeneralNews http://t.co/cWZHgEzAJ4
778254891	Obama Declares Disaster for Typhoon-Devastated Saipan: Obama signs disaster declaration for Northern Marians a... http://t.co/9i6CrCRq2m
778254892	RT_America: RT RT_com: Eye of Super Typhoon Soudelor seen from space (TIME-LAPSE) https://t.co/FC3BxRtHPG http://t.co/BIU4koWGlz
778254893	Typhoon Soudelor taking dead aim at Taiwan http://t.co/3Ac5wuy1R0
778254894	Global precipitation measurement satellite captures 3-D image of Typhoon Soudelor - @NASAHurricane http://t.co/iGCEtuMkcW
778254895	Obama Declares Disaster for Typhoon-Devastated Saipan http://t.co/CanEyTtwEV #international
778254896	Typhoon Soudelor heads for Taiwan http://t.co/Pg0BhL6FQC #wtf #news #tv #fun #funny
778254897	nbanews Soudelor Typhoon Soudelor is taking dead aim at Taiwan and is expected to make landfall Friday according to the Joint Typhoon_
778254898	(#LosDelSonido) Obama Declares Disaster for Typhoon-Devastated Saipan: Obama signs disaster declaration for Northern Ma...  (#IvanBerroa)
778254899	Obama Declares Disaster for Typhoon-Devastated Saipan: Obama signs disaster declaration for Northern Marians a... http://t.co/PC8BvufLFJ
778254900	Obama Declares Disaster for Typhoon-Devastated Saipan: Obama signs disaster declaration for Northern Marians a... http://t.co/BHZr9UgUs2
778254901	Obama Declares Disaster for Typhoon-Devastated Saipan
778254902	Obama Declares Disaster for Typhoon-Devastated Saipan: Obama signs disaster declaration for Northern Marians a... http://t.co/VTS9CAyiBC
778254903	Price of vegetables rises on Typhoon Soudelor concerns http://t.co/GeI58Vhbw6
778254904	UK WEATHER ALERT: Remnants of Asian super typhoon Soudelor to cause VIOLENT ... - http://t.co/JXOcfzKyw7 http://t.co/sZx1v2mk8K
778254905	Map: Typhoon Soudelor's predicted path as it approaches Taiwan; expected to make landfall over southern China by... http://t.co/YvaFI3zuJx
778254906	Obama Declares Disaster for Typhoon-Devastated Saipan: Obama signs disaster declaration for Northern Marians after typhoon hits US territory
778254907	Photos: Typhoon Soudelor Has Its Aim Set on Taiwan andChina http://t.co/3OG66NfSIG
778254909	Massive Typhoon heads toward Taiwan. http://t.co/Na2Ey64Vsg
778254910	A GPM satellite 'bullseye' in Typhoon Soudelor http://t.co/7vcEzi6CbB
778254911	Global precipitation measurement satellite captures 3-D image of Typhoon Soudelor - @NASAHurricane http://t.co/MvSRjd4X3D
778254912	#Trending #Viral Spectacular satellite view of Typhoon Soudelor @rumblevideo http://t.co/VkF0gkZ9N3
778254913	#WorldNews #World Saipan Has No Water Electricity in Typhoon Aftermath - Voice of America - World - Google News.. http://t.co/5sUdXgNdA3
778254914	Striking views of Super Typhoon Soudelor as it tracks toward Taiwan China http://t.co/hsjp6Hoffe
778254915	Saipan has no water electricity in aftermath of typhoon http://t.co/UBAk5uOI48
778254916	Map: Typhoon Soudelor's predicted path as it approaches Taiwan; expected to make landfall over southern China by S_ http://t.co/0XCb7yeqmw
778254917	A GPM satellite 'bullseye' in Typhoon Soudelor http://t.co/piVeUPiRKY
778254918	4Yygb mhtw4fnet Thousands evacuated as Taiwan prepares for strongest typhoon of 2015 - ABC Online
778254919	I think a Typhoon just passed through here lol
778254920	Please recover from the Typhoon. ????
778254921	Obama Declares Disaster for Typhoon-Devastated Saipan: Obama signs disaster declaration for Northern Marians a... http://t.co/a1MoeJxqyA
778254922	#abc Obama Declares Disaster for Typhoon-Devastated Saipan http://t.co/ueHFZTeYHu #international #news
778254923	#ABCNews Obama Declares Disaster for Typhoon-Devastated Saipan: Obama signs disaster declaration for No... http://t.co/DOBZc3piTM #World
778254924	Obama Declares Disaster for Typhoon-Devastated Saipan: Obama signs disaster declaration for Northern Marians a... http://t.co/lEYJwNnAH8
778254925	Typhoon Soudelor taking dead aim at Taiwan http://t.co/sA5CDWVDXt
778254940	Where bottle cherry timbering facilities upheaval entryway?: fJiZzTxK
778254945	How long O Lord (Study 3) The sixth seal opens the events of Revelation 12. The political upheaval in the Roman... http://t.co/GW0CXoOJyV
778245829	HAPPENING NOW - FDNY RESCUE 1 BLAZING THRU@AND BLASTING THE AIR HORN_ https://t.co/bX6cwRt8M7
778254948	Ancient Mayan Tablet Found in Jungle Temple http://t.co/qp6q8RS8ON
778254960	A Look at State Actions a Year after Ferguson۪s Upheaval https://t.co/M4tuI0P9nT MD is mentioned in the last group for a 'reporting' bill
778254965	A Look at State Actions a Year After #Ferguson's Upheaval http://t.co/qwSbVfLPE1
778254971	@nytimes Due to upheaval created by the west in Iraq Syria Libya etc.
778254972	This week we received the sad news of our friends daughters cancer prognosis. This is the second upheaval in this... http://t.co/tpOptWMWFR
778254974	A look at state actions a year after Ferguson's upheaval http://t.co/vXUFtVT9AU
778254976	@RoxYunkFalls August 4 1915 http://t.co/jjNS0YjaLA Violent storm strikes city Manayunk flooding and damage. Sports &amp; War news
778254977	Terrifying POV footage captures violent landing from inside a passenger jet during a storm in Amsterdam http://t.co/NqXQYI70W4 #travel
778245832	Satelite Shot: Series of wildfires in Northern California continue blazing: There are at least five fire compl... http://t.co/BmGuHqY7W4
778254978	Dramatic Video Shows Plane Landing During Violent Storm http://t.co/YX8OdrrINr
778254979	@hippieXox If the word 'violent' comes to mind it's food poisoning. Nothing you can do but weather the storm about 24 hours.  :(
778254980	And Kolkata is struck by a Cyclonic Storm. Sumthng big is gonna happen 2day evng. Heavy rains nd a violent storm approachng. God help us.
778254981	Rather violent storm. Possibility of no stream tonight.
778254982	Violent Storm Causes Damage Flooding in Watertown - http://t.co/3ZASZ6wxjJ
778254983	More Severe Weather Heads Toward Chicago Area: A brief violent storm swept through the Chicago area Sunday af... http://t.co/JWSLLsuKjg
778254984	Terrifying POV footage captures violent landing from inside a passenger jet during a storm in Amsterdam http://t.co/TyAOYEpelz
778254985	[WP] You work on the top floor of a hotel when suddendly a violent storm comes the news proclaims your city in a _ http://t.co/S6Rc7dbAL1
778254986	Thunder pounds north goes black a deep bruise on the sky's chest wind cries its pain. A summer storm has a tough life short violent.
778254987	#stormchase Violent Record Breaking EF-5 El Reno Oklahoma Tornado Nearly Runs Over ... - http://t.co/3SICroAaNz http://t.co/I27Oa0HISp
778254988	RT @calgarysun: Sun photographer Stuart Dryden spotted this vortex spun off a violent storm in Sylvan Lake. #abstorm http://t.co/w0BZ0JNGvB
778254989	#Amsterdam POV video captures violent landing at Amsterdam Airport Schiphol during a st... http://t.co/AlUMrGl40e http://t.co/8h2KCTFB8I
778254990	Storm batters Auckland and Northland: A violent overnight storm has battered Auckland and Northland uprooting... http://t.co/enrPGRgtTs
778254993	After a violent afternoon storm more severe weather heads for Chicago tonight. Details ----&gt; http://t.co/6Peeip4y7W
778254995	I don't understand 'taking' ANY life as a trophy. It's violent killing. http://t.co/NEqW47E1uj #CecilTheLion #BADChoices #BANTROPHYHUNTING
778254996	Holy crap! BRAVO Sir! Amazing! Dramatic Video Shows Plane Landing During Violent Storm http://t.co/xB0bw8h8Ur
778254997	Violent Forces Radio: Now Playing Acid Storm - Scourgue Of The Gods TuneIn Player @ http://t.co/XsSgEdSbH4
778254999	Circus tent collapses in violent storm killing 2 kids in New Hampshire http://t.co/j0saXEKBTa
778255000	U.S.PACIFIC COMMAND. I can see it! They gave their all in the peace unity festiva It disappears when freedom A Violent Storm hit Sea
778255002	@Vickie627 Desert Storm was an unqualified victory a treaty was signed.  Under Clinton the situation only got worse and more violent. #tcot
778255003	Storm is here! Violent winds and pounding rains in Evergreen. #yyc
778255004	POV footage captures violent landing from inside plane during storm http://t.co/kxewlHH7Uw
778255006	Stay inside for the next little while kids. We're having a bit of a violent storm right now. -kjc
778255008	Watch: Violent Storm Causes Deadly Accident at New Hampshire Circus http://t.co/jpPiR3ZzKA #GMA http://t.co/nV5GCDpIBA
778255009	Dramatic Video Shows Plane Landing During Violent Storm - http://t.co/oQ0LnF2Yug http://t.co/tZDBcGpSAg
778255010	Dramatic Video Shows Plane Landing During Violent Storm http://t.co/XRgPdlSWfD
778255012	POV video captures violent landing at Amsterdam Airport Schiphol during a storm ... http://t.co/fkv5qXDcy3
778255013	Storm blitzes Traverse City disrupts Management Briefing Seminars: A violent summer storm blitzed through Tra... http://t.co/NKAW9EZqGg
778255015	This is one violent and belligerent storm. I'm enjoying watching it unfold
778255016	@iateyourfood yikes.  Poor pup.  What a weird violent storm.
778255017	A brief violent storm swept through the Chicago area Sunday afternoon leading to one death and an evacuation of Lollapalooza and more
778255018	#calgaryweather  It would be nice if they would fix radar before another violent storm  Uninformed citizens dangerous #YYC #yycweather
778255019	Storm batters top half of North Island: A violent overnight storm has battered the upper North Island uprootin... http://t.co/fHVOkmpheD
778255020	Slow clap for this pilot. Dramatic Video Shows Plane Landing During Violent Storm http://t.co/CgVUY3RcxO
778255021	If you were the NWS wth a rotating storm w/ a report of a 'HUGE' / 'MASSIVE' / 'VIOLENT' tornado what would you do? https://t.co/J3dI85IST5
778255022	Dramatic Video Shows Plane Landing During Violent Storm http://t.co/rJ9gkJKJJn
778255023	2012#Shell's 250-foot-tall drilling rig broke loose from a towline&amp;drifted out of control during violent winter storm #incompetent #shellno
778255024	POV video captures violent landing at Amsterdam Airport Schiphol during a storm - Daily Mail http://t.co/seShqN5DSK #Amsterdam #News
778255025	Violent video: Ukraine rioters brutally beat police storm local admin building WE'RE ALL FIGHTING BACK  http://t.co/Byj5Dfa2rv
778255026	Jetstar and Virgin forced to cancel Bali flights again because of ash from Mount Raung volcano http://t.co/jTJoFLtMS4
778255027	nside a Dragon's belly. Or an ice cave under a volcano in Kamchatka | Photography by Daniel Korzhonov http://t.co/8T36HWgoqd
778255028	Japan Aogashima Volcano. By Unknown - Check It Out! http://t.co/OegFQBIqIq #Aogashima #Japan #photography #Volcano
778255030	#Earthquake #Sismo M 1.9 - 5km S of Volcano Hawaii: Time2015-08-06 01:04:01 UTC2015-08-05 15:04:01 -10:00 at ... http://t.co/eTswuoD3oM
778255032	1.94 earthquake occurred 5km S of Volcano Hawaii at 01:04 UTC! #earthquake #Volcano http://t.co/auf4J4Owj1
778255033	1.9 #Earthquake in 5Km S Of Volcano Hawaii #iPhone users download the Earthquake app for more information http://t.co/V3aZWOAmzK
778255035	Eruption of Indonesian volcano sparks transport chaos: In this picture done from video Mount Raung in_ http://t.co/7muG2kAhL7 ?
778255037	The sunset looked like an erupting volcano .... My initial thought was the Pixar short Lava http://t.co/g4sChqFEsT
778255038	USGS reports a M1.94 #earthquake 5km S of Volcano Hawaii on 8/6/15 @ 1:04:01 UTC http://t.co/Njd28pg9Xv #quake
778255040	USGS EQ: M 1.9 - 5km S of Volcano Hawaii: Time2015-08-06 01:04:01 UTC2015-08-05 15:04:01 -10:00 a... http://t.co/3rrGHT4ewp #EarthQuake
778255041	#USGS M 1.9 - 5km S of Volcano Hawaii: Time2015-08-06 01:04:01 UTC2015-08-05 15:04:01 -10:00 at epicenter... http://t.co/dIsrwhQGym #SM
778255042	@MrMikeEaton @Muazimus_Prime hill hill mountain volcano of hell mountain hill hil.
778255045	@Jesssssssee @eevans17 The Illuminati: The Yellowstone Super Volcano Conspiracy http://t.co/wymv9cYxzK
778255046	idgaf fly into a volcano
778255047	M1.94 [01:04 UTC]?5km S of Volcano Hawaii. http://t.co/zDtoyd8EbJ
778255048	?? @ KETEP VOLCANO CENTRE ketep PASS https://t.co/IdBnKxu80L
778255051	#USGS M 1.9 - 5km S of Volcano Hawaii: Time2015-08-06 01:04:01 UTC2015-08-05 15:04:01 -10:00 at epicenter... http://t.co/meVvkaXcdE #SM
778255054	I added a video to a @YouTube playlist http://t.co/y2Mt6v13E8 Doc: Volcanoes and Earthquakes - Inside the Volcano
778255055	Not only does he know the latest research the kiddo's GI specialist sang the volcano number from Inside Out. Now THAT is whole person care.
778255056	#Sismo M 1.9 - 5km S of Volcano Hawaii: Time2015-08-06 01:04:01 UTC2015-08-05 15:04:01 -10:00 at epicente... http://t.co/K28mgWTZcV #CS
778255057	@alextucker VOLCANO BOWL DRINK
778255058	Quake: M 1.9 - 5km S of Volcano Hawaii
778255062	Zeal is a volcano the peak of which the grass of indecisiveness does not grow
778255064	@volcano_tornado live somewhere else for a while and Da Mill ain't too bad son! #perspective
778255065	#Sismo M 1.9 - 5km S of Volcano Hawaii: Time2015-08-06 01:04:01 UTC2015-08-05 15:04:01 -10:00 at ep... http://t.co/RTUeTdfBqb #CSismica
778255066	The Architect Behind Kanye West's Volcano - New York Times http://t.co/3QJUExX0Y0
778255073	Thank you to @scegnews! Our neighborhood looks like a war zone but we had power back in 4 hours!
778255079	Sammy is here in this war zone. Jamal spoke to me on the phone. Now my wife is next to speak to me ...what else can&gt; http://t.co/2CppfprxoG
778255083	the war on drugs has turned the U.S. into a WAR zone.
778255085	Saipan looks like a war zone though
778255086	#DebateQuestionsWeWantToHear If U start another war would U B willing 2 go 2 the war-zone yourself or send UR sons and/or daughters 2 fight?
778255088	#WorldWatchesFerguson #Florida @GovJayNixon @clairecmc How dare you turn our streets into a war zone -a war against CITIZENS?
778255092	Looks and sounds like a war zone
778255095	Um OK '@dandre_5: Sundays during football seasonfrom about 9 am - 11 pm women shouldn't even log onshit be a complete war zone'
778255097	Just trying to find my my peace in a Zone of war
778245844	@BlazingRoselia California is hot but not blazing even though there are wildfires going on now. Even the big massive Rocky fire
778255100	The Resistance wages guerrilla warfare against KPA forces in the Red Zone the war-torn outskirts of... http://t.co/WFxAwQvvjr
778255101	THIS IS A ONE DIRECTION CONCERT NOT A WAR ZONE WHAT IS THIS #OTRAMETLIFE http://t.co/PtY9HRCUZH
778255102	Looks like a war zone outside. What's going on?
778255104	70 years ago today the U.S.  dropped a nuclear weapon on Japan. Here are some articles that share my opinion on that decision_
778255106	Abe government said the missiles were not 'weapon' so JSDF could provide them to the ally when collective self defense right was exercised.
778255107	Please allow me to reiterate it's not the weapon it's the mindset of the individual! #professional #help! -LEGION! https://t.co/2lGTZkwMqW
778255114	Cat Of Nine Irons XII: This nightmarishly brutal weapon is used in ritualistic country club de http://t.co/xpFmR368uF http://t.co/nmAUMYdKe1
778255122	Iranian warship points weapon at U.S. helicopter official says http://t.co/SnqfHpYm3O #tcot
778255123	BREAKING: Obama Officials GAVE Muslim Terrorist the Weapon Used in Texas Attack http://t.co/RJcaxjp4oS
778255125	@abcnews A nuclear bomb is a terrible weapon!!
778255128	Rare insight into #terror and How to fight it http://t.co/t6OBVWaPhW #Cameroon #USA #Whitehouse #ES #FR #Nigeria #UK #Africa #DE #CA #AU #JP
778255133	Abe's government made clear that grenades were not 'weapon.'
778255136	Even if u have your weapon and your badge we gonna put them choppas on your ass????
778255142	On 70th anniversary of #Hiroshima bomb it is important to learn from history and ban this weapon.
778245849	#Nepal: This house near TIA bleeding int۪l airline companies dry. | http://t.co/lI8wi1kuMY
778255148	That day remember the nuclear weapon power......Hiroshima 70th
778255149	03/08/11: Police stop a 41-year-old in the Bronx citing 'casing a victim or location.' No weapon is found.
778255150	Lol Look how tough some people talk that live in some of the most gang infested cities in America Your mouth isn't a weapon You fucking wimp
778255152	Iranian warship points weapon at American helicopter... http://t.co/cgFZk8Ha1R
778255155	Agreed there - especially on automatic weapons. There's no legitimate reason for needing one @Argus_99 @HeidiA1438
778255157	I'm sorry but if you have to resort to weapons to settle something you're a pussy win or lose take your shit like a man &amp; leave it at that
778255158	Incredulous at continued outcry of welfare being a waste of taxpayers money but never similar objection to 100bn on nuclear weapons
778255159	Since the chemical-weapons 'red line' warning on 20 August 2012 LCC have confirmed that at least 96355 people have been killed in #Syria.
778255162	Friendly reminder that the only country to ever use nuclear weapons is the U.S. And it was against civilians. https://t.co/7QrEPylLUK
778255167	Hiroshima and Nagasaki I remember all those killed in alleged US war crimes using nuclear weapons https://t.co/NDxrK2NCLN #USWarCrimes
778255173	@NRO Except when ordered not to carry unauthorized weapons while on duty or in military uniforms. THATS THE RULE FOOL
778255174	Aug 3 1915KILL 10000 WITH ROCKS.; Italians Make Good Use of Nature's Weapons -- Excel with Bayonet.
http://t.co/ck1mMvHU0T
778255176	Ukraine argues for US weapons during Pelosi's visit to Kiev http://t.co/jnN0kRNXvY http://t.co/5LOiWuyv5r
778255183	@eyecuts @Erasuterism I love 96 Gal Deco to death even if it's a bit trickier to be great with. Glad more weapons are getting Splash Wall
778255184	#Battlefield 1942 forgotten hope secret weapons
778255185	WWII Memories Plus Lessons of Hiroshima We Still Need Nuclear Weapons http://t.co/xbMm7ITe9q #denver #billings #rapidcity #seattle #cheyenne
778255188	NAVY SAYS LT CMDR WHO FIRED SIDEARM IN DEFENSE DURING NOSC CHATTANOOGA TERRORIST ATTACK WILL NOT FACE CHARGES... http://t.co/vCcDKC4qt2
778255189	PM Abe pledged to make every effort to seek a world without nuclear weapons. http://t.co/CBXnHhZ6kD
778255192	I will adamantly opposed to nuclear weapons.
778255193	WWII Memories Plus Lessons of Hiroshima We Still Need Nuclear Weapons http://t.co/MTgFx3efIv #denver #billings #rapidcity #seattle #cheyenne
778255200	Navy: No charges against officer for weapons violations in Chattanooga attack http://t.co/hddBMU2ycA
778255201	'The Reagan Administration had arranged for Israeli weapons to be sent to the Guatemalan Army  http://t.co/4fYNQ1hWWb
778255202	In memory of the victims of Hiroshima and Nagasaki. Never again! Ban nuclear weapons! : https://t.co/J3cIRXjFa6
778255208	A quarter whirlwind. They don't see it coming.
778255209	Missing Malaysian airplane: Debris was planted  Families News - WhirlWind News http://t.co/bLd0nHKzbh
778255212	Weather forecast for Thailand  A Whirlwind is coming ...2 september https://t.co/rUKjYjG9oQ
778255214	life can wild when... you're caught in a whirlwind ??
778255215	Warcraft has always been this weird referential whirlwind to itself and other things
778244920	Reported motor vehicle accident in Curry on Herman Rd near Stephenson involving an overturned vehicle. Please use... http://t.co/YbJezKuRW1
778245856	you can stab me in the back but I promise you'll be the one bleeding
778255224	Back from Seattle Tacoma and Portland. Whirlwind! http://t.co/qwHINBni8e
778255227	I moved to England five years ago today. What a whirlwind of time it has been! http://t.co/eaSlGeA1B7
778255228	Whirlwind Medusa Audio Snake: 16 microphone inputs 0 returns 150 ft http://t.co/mxkAlMQpdb http://t.co/8KZnhtYtt9
778255230	@byuwnbeki The sad eyes and tacit stories in your heart that night in which the whirlwind was raging
778255232	Whirlwind that has lasted for more than an hour and still strong. A standstill in parts of middle east.
778255236	Two hours to get to a client meeting. Whirlwind of emotions with this #tubestrike
778255238	Feel like I've got no control of anything that goes on in my life at the minute. #whirlwind #drained
778255239	Richard returns after whirlwind few days http://t.co/L8W30WFW3R #MLB
778255244	@ckosova Read Whirlwind about this subject amongst others. The bomb saved millions of lives yes that's true.
778255251	This past week has been an absolute whirlwind.... Athens bound
778255252	WIN: Lisowski whitewashes the Whirlwind 5-0 in round 2 of Shanghai Masters Quals! |  http://t.co/MLigPUHVOh #snooker http://t.co/TcS2Cd5y6y
778255253	#HarperANetflixShow  Blazing Saddles  (a show about wild fires in Alberta)
778255254	As wild fires blacken northern California parched Harris County becomes tinder box.  https://t.co/i2lwTy5YuP
778255255	?? #BREAKING: massive wild- and field fires reported throughout Germany! The most fires are in eastern #German http://t.co/4zSIy7EO2O
778255256	We all complain about PA but atleast we don't have those wild fires taking our homes like north Cali or the floods in Florida right now
778255257	Collection of Articals and Video of West Coast Wild Fires by @ABC http://t.co/qd3DSSFWUE
778255258	my wife has opted to take holidays &amp; historically since we met @lanahillman gets special treatment her bonfires can't start wild fires-RAIN!
778255259	My brother-n-law riooooos got the call to head up north and fight the wild fires. Dudes a beast at_ https://t.co/463P0yS0Eb
778255261	Several wild fires have burned a lot of land in California. Here is one of the larger fires. http://t.co/2M1gNeaiFl http://t.co/UQh85MiP0v
778255262	Map shows where all of California's wild#fires are burning: This map created by CAL FIRE_ http://t.co/0x8jAQToWM http://t.co/m1RoSi2Wcs
778255263	Some great footage of STRONG work from San Bernardino County Fire who is also working the wild fires right now.... http://t.co/QCYQHvn2Ha
778255264	God forbid this is true #California has enough problems with severe #drought &amp; #wild fires. http://t.co/CMsgexM4FC #Nuclear Power #SanOnofre
778255265	NetNewsLedger Wild Fire Update  August 4 2015: THUNDER BAY  WEATHER  Therewere no new fires confirmed by t... http://t.co/JflxgEmBdA
778255266	Firefighters Headed To California To Fight Wild Fires http://t.co/J2PYkYo0EN
778255267	#FOXDebateQuestions:  To what degree has Obama's efforts to institute Sharia Law exacerbated the California wild fires?
778255268	PRAYERS FOR MY COUSIN! He's in California helping with the wild fires.
